{
  "$schema": "https://json-schema.org/draft/2020-12/schema",
  "title": "Blend",
  "type": "object",
  "additionalProperties": false,
  "required": ["id","name","aliases","components","other_components","regulatory_status","used_for","summary","administration_guidance","side_effects","internet_claims","research","last_reviewed"],
  "properties": {
    "id": {"type":"string","pattern":"^[a-z0-9-]+$"},
    "name": {"type":"string","minLength":1},
    "aliases": {"type":"array","items":{"type":"string"}},
    "components": {"type":"array","minItems":1,"items":{"type":"string","pattern":"^[a-z0-9-]+$"}},
    "other_components": {"type":"array","items":{"type":"string","minLength":1}},
    "regulatory_status": {"enum":["approved","investigational","unapproved"]},
    "used_for": {"type":"string","minLength":1},
    "summary": {"type":"string","minLength":1},
    "administration_guidance": {"$ref":"#/$defs/notes"},
    "side_effects": {"$ref":"#/$defs/notes"},
    "internet_claims": {"type":"array","items":{
      "type":"object","additionalProperties":false,
      "required":["claim","source_type","url","retrieved"],
      "properties":{
        "claim":{"type":"string"},
        "source_type":{"enum":["reddit","youtube","podcast","forum","influencer","website","vendor"]},
        "url":{"type":["string","null"]},
        "retrieved":{"type":"string","pattern":"^\\d{4}-\\d{2}-\\d{2}$"}}}},
    "research": {"type":"array","items":{
      "type":"object","additionalProperties":false,
      "required":["id","evidence_type","source_kind","identifier","year","summary","finding"],
      "properties":{
        "id":{"type":"string"},
        "evidence_type":{"enum":["human_trial","animal_study","in_vitro","fda_label","regulatory_document","case_report","systematic_review","review","regulator_notice"]},
        "source_kind":{"enum":["pubmed","clinicaltrials","fda","regulator"]},
        "identifier":{"type":"string"},
        "year":{"type":"integer"},
        "summary":{"type":"string"},
        "finding":{"type":"string"}}}},
    "last_reviewed": {"type":"string","pattern":"^\\d{4}-\\d{2}-\\d{2}$"}
  },
  "$defs": {
    "notes": {"type":"array","items":{"oneOf":[
      {"type":"object","additionalProperties":false,"required":["text","label","citation_id"],
       "properties":{"text":{"type":"string","minLength":1},"label":{"const":"research"},"citation_id":{"type":"string"}}},
      {"type":"object","additionalProperties":false,"required":["text","label","source_type","url","retrieved"],
       "properties":{"text":{"type":"string","minLength":1},"label":{"const":"internet"},
        "source_type":{"enum":["reddit","youtube","podcast","forum","influencer","website","vendor"]},
        "url":{"type":["string","null"]},
        "retrieved":{"type":"string","pattern":"^\\d{4}-\\d{2}-\\d{2}$"}}}]}}
  }
}
