{
  "id": "aod-9604-secretagogue",
  "name": "AOD-9604 with a GH secretagogue",
  "aliases": [],
  "components": [
    "aod-9604"
  ],
  "other_components": [
    "a growth hormone secretagogue (varies by seller)"
  ],
  "regulatory_status": "unapproved",
  "used_for": "Described by telehealth sources as a fat-loss and body composition stack pairing AOD-9604 with a peptide that stimulates growth hormone release.",
  "summary": "This is a category of blend rather than one fixed product: AOD-9604, an unapproved growth hormone fragment, is combined with an unspecified growth hormone secretagogue that varies by seller. No approved product and no combination-specific human study was found. Each component's own page holds the detailed information (AOD-9604 is in the library; the secretagogue depends on the product and may have its own page); formulations vary by seller.",
  "administration_guidance": [],
  "side_effects": [],
  "internet_claims": [
    {
      "claim": "A telehealth company's blog (Meto, which offers compounded medications) lists AOD-9604 combined with a growth hormone axis peptide among popular stacks.",
      "source_type": "vendor",
      "url": null,
      "retrieved": "2026-10-01"
    },
    {
      "claim": "A telehealth company's blog (Meto, which offers consultations and compounded medications) says most peptide stacks have far more marketing momentum than clinical evidence, especially for combinations, and that more experimental stacks call for a more conservative risk posture.",
      "source_type": "vendor",
      "url": null,
      "retrieved": "2026-10-01"
    }
  ],
  "research": [],
  "last_reviewed": "2026-10-01"
}
